{
  "action_summary": {
    "approval_required": 0,
    "block": 0,
    "inform": 0,
    "review_required": 0
  },
  "artifacts": {
    "audit": "audit.json",
    "explain": "explain.json",
    "lint": "lint.json",
    "plan": "plan.json"
  },
  "blocking_reasons": [],
  "evidence": {
    "generated_at": "2026-06-30T16:18:50Z",
    "inputs": {
      "current": {
        "path": "examples/artifacts/review-cases/passed/current.json",
        "sha256": "e24ba97b800c757a5a9f14fb34e362e892515004b1404d1627f491279739489c",
        "source": "current_snapshot"
      },
      "desired": {
        "path": "examples/artifacts/review-cases/passed/desired.json",
        "sha256": "e24ba97b800c757a5a9f14fb34e362e892515004b1404d1627f491279739489c",
        "source": "desired_state"
      }
    },
    "lfpolicy_version": "0.10.0",
    "truncation": {
      "artifacts": [],
      "truncated": false
    }
  },
  "hard_block": false,
  "recommended_action": "inform",
  "schema_version": "lfpolicy.review.summary.v1",
  "status": "passed",
  "summary": {
    "audit": {
      "errors": 0,
      "total": 0,
      "warnings": 0
    },
    "explain": {
      "planned_grant_changes": 0
    },
    "lint": {
      "errors": 0,
      "total": 0,
      "warnings": 0
    },
    "plan": {
      "destructive": 0,
      "safe": 0,
      "total": 0
    }
  }
}
